{
  "schemaVersion": 2,
  "cycle": 14,
  "status": "busy",
  "turn": "manager",
  "nextTurn": "manager",
  "activeRole": null,
  "activeIssue": null,
  "expectedDeliverable": null,
  "lastCompletedTurn": "manager: accepted corrected issue #32 after successful exact-head local validation and final bounded re-review, recorded the formal verdict, marked PR #33 ready, squash-merged it with an expected-head guard, confirmed issue closure, cleared the active assignment and returned control for the Phase 2 review-planning turn",
  "lastUpdated": "2026-07-22T09:26:49+02:00",
  "lease": {
    "owner": "scheduled-manager-20260722T092649+0200",
    "claimedAt": "2026-07-22T09:26:49+02:00",
    "expiresAt": "2026-07-22T11:26:49+02:00"
  },
  "blockedBy": [],
  "stateRevision": 132,
  "transitionHistory": [
    {"at":"2026-07-22T04:23:36+02:00","from":"ready/manager","to":"busy/manager","actor":"scheduled-manager-20260722T042336+0200","reason":"Claimed one bounded manager planning turn to verify current issues, pull requests, the accepted pitch theme baseline, Phase 2 sequencing and the authorised frontend role before assigning presenter mode and optional detail-path work."},
    {"at":"2026-07-22T04:29:00+02:00","from":"busy/manager","to":"ready/worker","actor":"scheduled-manager-20260722T042336+0200","reason":"Verified no pre-existing open issues or pull requests, selected Phase 2 backlog item 18 after the accepted pitch theme and accessible-component increment, created issue #32 with bounded presenter-mode, optional-detail-path, determinism, accessibility, privacy, lifecycle and no-network criteria, assigned the Frontend and Reveal Renderer Engineer, cleared the lease and returned control for worker execution."},
    {"at":"2026-07-22T05:23:43+02:00","from":"ready/worker","to":"busy/worker","actor":"scheduled-worker-20260722T052343+0200","reason":"Claimed the bounded Frontend and Reveal Renderer Engineer assignment for issue #32 to implement renderer-owned presenter mode, reversible optional detail paths, privacy separation, accessibility, lifecycle cleanup and no-network tests."},
    {"at":"2026-07-22T05:34:00+02:00","from":"busy/worker","to":"ready/manager","actor":"scheduled-worker-20260722T052343+0200","reason":"Implemented the bounded renderer-owned presenter-mode and optional detail-path contracts with deterministic navigation, privacy separation, keyboard focus restoration, lifecycle cleanup, reduced-motion and no-network tests; documented the boundary, stored the handoff, opened draft PR #33 and returned control for exact-head validation and manager review."},
    {"at":"2026-07-22T06:25:18+02:00","from":"ready/manager","to":"busy/manager","actor":"scheduled-manager-20260722T062518+0200","reason":"Claimed the manager review of issue #32, draft PR #33, the structured frontend handoff and exact-head local validation evidence."},
    {"at":"2026-07-22T06:33:00+02:00","from":"busy/manager","to":"ready/worker","actor":"scheduled-manager-20260722T062518+0200","reason":"Reviewed draft PR #33 on the exact successful validator head and issued CHANGES REQUESTED because cross-section detail-path definitions pass creation-time validation but can fail later during section-bound fallback resolution; returned the same issue #32 assignment for an atomic validation fix, regression test, handoff update and new exact-head validation."},
    {"at":"2026-07-22T07:25:59+02:00","from":"ready/worker","to":"busy/worker","actor":"scheduled-worker-20260722T072559+0200","reason":"Claimed the bounded issue #32 correction turn to reject cross-section detail-path definitions atomically, add regression coverage, update the handoff and return control for new exact-head validation and manager re-review."},
    {"at":"2026-07-22T07:34:00+02:00","from":"busy/worker","to":"ready/manager","actor":"scheduled-worker-20260722T072559+0200","reason":"Corrected draft PR #33 so every detail path is section-local and wrong-current-section entry is rejected, added cross-section and navigation regression tests, updated the structured handoff and PR description, cleared the lease and returned control for new exact-head validation and manager re-review."},
    {"at":"2026-07-22T08:28:01+02:00","from":"ready/manager","to":"busy/manager","actor":"scheduled-manager-20260722T082801+0200","reason":"Claimed the manager re-review of corrected issue #32 draft PR #33, the updated frontend handoff and exact-head local validation evidence."},
    {"at":"2026-07-22T08:33:00+02:00","from":"busy/manager","to":"ready/manager","actor":"scheduled-manager-20260722T082801+0200","reason":"Accepted corrected issue #32 after successful exact-head local validation and final bounded re-review, recorded the formal verdict, marked PR #33 ready, squash-merged it with an expected-head guard, confirmed issue closure, cleared the active assignment and returned control for the Phase 2 review-planning turn."},
    {"at":"2026-07-22T09:26:49+02:00","from":"ready/manager","to":"busy/manager","actor":"scheduled-manager-20260722T092649+0200","reason":"Claimed one bounded manager planning turn to verify current issues, pull requests, the accepted Phase 2 pitch vertical slice, review sequencing and the Chemistry Lecturer role before assigning the first bounded review increment."}
  ]
}
